{
  "version": "merchant-manifest/native-lightning/1",
  "merchantOrigin": "https://merchant.example",
  "intentApi": "https://merchant.example/v1/intents",
  "receiptVerification": {
    "version": "checkout-event/1",
    "algorithm": "Ed25519",
    "publicKey": "d04ab232742bb4ab3a1368bd4615e4e6d0224ab71a016baf8520a332c9778737",
    "eventPathTemplate": "/v1/intents/{id}/events"
  },
  "allowedPayerAssets": [{
    "id": "LN_BTC_REGTEST", "rail": "lightning", "network": "regtest",
    "amountUnit": "msat", "decimals": 11, "quantum": "1000", "tokenBehavior": "not_applicable"
  }],
  "acceptedReceiptAssets": [{
    "id": "LN_BTC_REGTEST", "rail": "lightning", "network": "regtest",
    "amountUnit": "msat", "decimals": 11, "quantum": "1000", "tokenBehavior": "not_applicable"
  }],
  "publicPolicy": {
    "version": "native-lightning/1",
    "receiver": "0279be667ef9dcbbac55a06295ce870b07029bfcdb2dce28d959f2815b16f81798",
    "network": "regtest", "maxBuyerExtraMsat": "0", "maxBuyerExtraBps": 0
  },
  "routingProfiles": [{ "id": "native-lightning/1", "routeClass": "native" }],
  "approvedAdapters": [{ "id": "native-lightning", "version": "native-lightning/1" }]
}
